{"$schema":"https://json-schema.org/draft/2020-12/schema","$id":"https://st-score-restore.example/schemas/dataset-catalog.schema.json","title":"ST Score Restore Stage 1 Dataset Catalog","description":"Version 1.3.0 structural metadata contract bound to ADR 0013 and ADR 0016. Python enforces cross-field, temporal, role, restriction, lineage, eligibility/profile, and revocation rules.","type":"object","additionalProperties":false,"required":["schemaVersion","entryDecisionId","catalogId","descriptionCode","items"],"properties":{"schemaVersion":{"const":"1.3.0"},"entryDecisionId":{"const":"adr-0013-stage-1-entry-v1"},"catalogId":{"$ref":"#/$defs/id"},"descriptionCode":{"type":"string","pattern":"^[a-z0-9][a-z0-9._-]{2,79}$"},"items":{"type":"array","minItems":1,"items":{"$ref":"#/$defs/item"}}},"$defs":{"id":{"type":"string","pattern":"^[a-z0-9][a-z0-9._-]{2,79}$"},"nullableId":{"type":["string","null"],"pattern":"^[a-z0-9][a-z0-9._-]{2,79}$"},"nullableDate":{"type":["string","null"],"pattern":"^\\d{4}-\\d{2}-\\d{2}$"},"nullableSha":{"type":["string","null"],"pattern":"^[0-9a-f]{64}$"},"nullableEvidence":{"type":["string","null"],"pattern":"^evidence:opq_[0-9a-f]{32}$"},"restriction":{"oneOf":[{"type":"object","additionalProperties":false,"required":["type","values"],"properties":{"type":{"const":"split_allowlist"},"values":{"type":"array","minItems":1,"uniqueItems":true,"items":{"enum":["development","calibration","held_out","training_reserved"]}}}},{"type":"object","additionalProperties":false,"required":["type","values"],"properties":{"type":{"const":"storage_class_allowlist"},"values":{"type":"array","minItems":1,"uniqueItems":true,"items":{"enum":["managed_standard","managed_restricted","high_assurance_vault"]}}}},{"type":"object","additionalProperties":false,"required":["type","values"],"properties":{"type":{"const":"environment_allowlist"},"values":{"type":"array","minItems":1,"uniqueItems":true,"items":{"const":"stage1_offline"}}}},{"type":"object","additionalProperties":false,"required":["type","allowed"],"properties":{"type":{"const":"external_export"},"allowed":{"type":"boolean"}}},{"type":"object","additionalProperties":false,"required":["type","date"],"properties":{"type":{"const":"retention_not_after"},"date":{"type":"string","pattern":"^\\d{4}-\\d{2}-\\d{2}$"}}}]},"permission":{"type":"object","additionalProperties":false,"required":["status","authorizationReference","authorizedBy","authorizedOn","expiresOn","restrictions","revokedOn","revocationReference"],"properties":{"status":{"enum":["not_requested","pending","granted","denied","expired","withdrawn","not_applicable"]},"authorizationReference":{"type":["string","null"],"pattern":"^evidence:opq_[0-9a-f]{32}$"},"authorizedBy":{"type":["string","null"],"pattern":"^actor\\.purpose:opq_[0-9a-f]{32}$"},"authorizedOn":{"$ref":"#/$defs/nullableDate"},"expiresOn":{"$ref":"#/$defs/nullableDate"},"restrictions":{"type":"array","items":{"$ref":"#/$defs/restriction"}},"revokedOn":{"$ref":"#/$defs/nullableDate"},"revocationReference":{"type":["string","null"],"pattern":"^evidence:opq_[0-9a-f]{32}$"}}},"parameterValue":{"oneOf":[{"type":"null"},{"type":"boolean"},{"type":"number"},{"type":"array","items":{"$ref":"#/$defs/parameterValue"}},{"type":"object","propertyNames":{"pattern":"^[a-z0-9][a-z0-9._-]{2,79}$"},"additionalProperties":{"$ref":"#/$defs/parameterValue"}}]},"item":{"type":"object","additionalProperties":false,"required":["datasetItemId","sourceFamilyId","parentItemId","eligibilityClass","artifact","provenance","privacy","input","permissions","split","retention","revocation","syntheticGeneration","review","assertions"],"properties":{"datasetItemId":{"$ref":"#/$defs/id"},"sourceFamilyId":{"$ref":"#/$defs/id"},"parentItemId":{"$ref":"#/$defs/nullableId"},"eligibilityClass":{"enum":["blocked","open_corpus","restricted_corpus","sensitive_custody"]},"artifact":{"type":"object","additionalProperties":false,"required":["state","sha256","byteSize","storageLocator","custodyProfileId","encryptionProfileId","custodianId"],"properties":{"state":{"enum":["metadata_only","external_available","revoked"]},"sha256":{"$ref":"#/$defs/nullableSha"},"byteSize":{"type":["integer","null"],"minimum":1},"storageLocator":{"type":["string","null"],"pattern":"^custody:opq_[0-9a-f]{32}$"},"custodyProfileId":{"type":["string","null"],"pattern":"^policy:opq_[0-9a-f]{32}$"},"encryptionProfileId":{"type":["string","null"],"pattern":"^policy:opq_[0-9a-f]{32}$"},"custodianId":{"type":["string","null"],"pattern":"^actor\\.custodian:opq_[0-9a-f]{32}$"}}},"provenance":{"type":"object","additionalProperties":false,"required":["sourceKind","sourceReference","rightsHolderId","licenseId","usageBasisCode","rightsReview"],"properties":{"sourceKind":{"enum":["project_authored","public_domain","licensed","user_provided","synthetic"]},"sourceReference":{"type":"string","pattern":"^evidence:opq_[0-9a-f]{32}$"},"rightsHolderId":{"type":"string","pattern":"^subject:opq_[0-9a-f]{32}$"},"licenseId":{"type":"string","pattern":"^[a-z0-9][a-z0-9._-]{2,79}$"},"usageBasisCode":{"enum":["project_authored","public_domain","license_grant","user_authorization","synthetic_derivation"]},"rightsReview":{"type":"object","additionalProperties":false,"required":["status","verifiedBy","verifiedOn","evidenceReference"],"properties":{"status":{"enum":["pending","approved","rejected"]},"verifiedBy":{"type":["string","null"],"pattern":"^actor\\.rights:opq_[0-9a-f]{32}$"},"verifiedOn":{"$ref":"#/$defs/nullableDate"},"evidenceReference":{"$ref":"#/$defs/nullableEvidence"}}}}},"privacy":{"type":"object","additionalProperties":false,"required":["classification","reviewStatus","reviewedBy","reviewedOn","evidenceReference","deidentificationMethodCode","deidentifiedArtifactSha256"],"properties":{"classification":{"enum":["none","deidentified","personal","student"]},"reviewStatus":{"enum":["not_required","pending","approved","rejected"]},"reviewedBy":{"type":["string","null"],"pattern":"^actor\\.privacy:opq_[0-9a-f]{32}$"},"reviewedOn":{"$ref":"#/$defs/nullableDate"},"evidenceReference":{"$ref":"#/$defs/nullableEvidence"},"deidentificationMethodCode":{"type":["string","null"],"enum":[null,"metadata_scrub","visual_redaction","metadata_scrub_and_visual_redaction"]},"deidentifiedArtifactSha256":{"$ref":"#/$defs/nullableSha"}}},"input":{"type":"object","additionalProperties":false,"required":["kind","mediaType","notationKinds","pageCount","degradations"],"properties":{"kind":{"enum":["digital_pdf","scanned_pdf","hybrid_pdf","jpg","jpeg","png","phone_photo"]},"mediaType":{"enum":["application/pdf","image/jpeg","image/png"]},"notationKinds":{"type":"array","minItems":1,"uniqueItems":true,"items":{"enum":["staff","guitar_tab","combined_staff_tab"]}},"pageCount":{"type":"integer","minimum":1},"degradations":{"type":"array","minItems":1,"uniqueItems":true,"items":{"enum":["none","skew","perspective","page_curl","shadow","glare","uneven_lighting","blur","noise","compression","low_resolution"]}}}},"permissions":{"type":"object","additionalProperties":false,"required":["fixture_validation","quality_evaluation","quality_calibration","pdf_pipeline_evaluation","safety_calibration","held_out_evaluation","synthetic_derivation","model_training","publication","demonstration"],"properties":{"fixture_validation":{"$ref":"#/$defs/permission"},"quality_evaluation":{"$ref":"#/$defs/permission"},"quality_calibration":{"$ref":"#/$defs/permission"},"pdf_pipeline_evaluation":{"$ref":"#/$defs/permission"},"safety_calibration":{"$ref":"#/$defs/permission"},"held_out_evaluation":{"$ref":"#/$defs/permission"},"synthetic_derivation":{"$ref":"#/$defs/permission"},"model_training":{"$ref":"#/$defs/permission"},"publication":{"$ref":"#/$defs/permission"},"demonstration":{"$ref":"#/$defs/permission"}}},"split":{"enum":["unassigned","development","calibration","held_out","training_reserved"]},"retention":{"type":"object","additionalProperties":false,"required":["policy","expiresOn","storageClass","deletionRequired","deletionStatus","deletionReceiptReference","deletionReceiptSha256"],"properties":{"policy":{"enum":["metadata_only","external_until_date","delete_after_validation","prohibited"]},"expiresOn":{"$ref":"#/$defs/nullableDate"},"storageClass":{"enum":["not_assigned","managed_standard","managed_restricted","high_assurance_vault"]},"deletionRequired":{"type":"boolean"},"deletionStatus":{"enum":["not_required","pending","completed","failed"]},"deletionReceiptReference":{"type":["string","null"],"pattern":"^receipt:opq_[0-9a-f]{32}$"},"deletionReceiptSha256":{"$ref":"#/$defs/nullableSha"}}},"revocation":{"type":"object","additionalProperties":false,"required":["status","effectiveOn","reference"],"properties":{"status":{"enum":["not_revoked","pending_deletion","completed"]},"effectiveOn":{"$ref":"#/$defs/nullableDate"},"reference":{"$ref":"#/$defs/nullableEvidence"}}},"syntheticGeneration":{"oneOf":[{"type":"null"},{"type":"object","additionalProperties":false,"required":["generator","generatorVersion","generatorCommit","generatedOn","derivationAuthorizationReference","seed","parameters"],"properties":{"generator":{"type":"string","pattern":"^[a-z0-9][a-z0-9._-]{2,79}$"},"generatorVersion":{"type":"string","pattern":"^\\d+\\.\\d+\\.\\d+$"},"generatorCommit":{"type":"string","pattern":"^[0-9a-f]{64}$"},"generatedOn":{"type":"string","pattern":"^\\d{4}-\\d{2}-\\d{2}$"},"derivationAuthorizationReference":{"type":"string","pattern":"^evidence:opq_[0-9a-f]{32}$"},"seed":{"type":"integer","minimum":0},"parameters":{"type":"object","propertyNames":{"pattern":"^[a-z0-9][a-z0-9._-]{2,79}$"},"additionalProperties":{"$ref":"#/$defs/parameterValue"}}}}]},"review":{"type":"object","additionalProperties":false,"required":["status","reviewedBy","reviewedOn","evidenceReference","noteCodes"],"properties":{"status":{"enum":["planned","pending","approved","rejected","revoked"]},"reviewedBy":{"type":["string","null"],"pattern":"^actor\\.dataset:opq_[0-9a-f]{32}$"},"reviewedOn":{"$ref":"#/$defs/nullableDate"},"evidenceReference":{"$ref":"#/$defs/nullableEvidence"},"noteCodes":{"type":"array","uniqueItems":true,"items":{"type":"string","pattern":"^[a-z0-9][a-z0-9._-]{2,79}$"}}}},"assertions":{"type":"object","additionalProperties":false,"required":["teacherApprovalImpliedDatasetPermission","teacherApprovalImpliedTrainingPermission","originalBytesInGit","stage1TrainingExecutionAuthorized"],"properties":{"teacherApprovalImpliedDatasetPermission":{"const":false},"teacherApprovalImpliedTrainingPermission":{"const":false},"originalBytesInGit":{"const":false},"stage1TrainingExecutionAuthorized":{"const":false}}}}}}}
